{
  "schema_version": "1.0.0",
  "library_id": "animalbank_stage1_curriculum_v1",
  "title": "Animal Bank 第一学段（1–2年级）音乐学习 Library V1.0",
  "stage_id": "stage_1",
  "grades": [
    1,
    2
  ],
  "course_form": "唱游·音乐",
  "status": "frozen_for_v3_p0",
  "product_scope": {
    "p0_modules": [
      "rhythm",
      "melody",
      "solfege",
      "singing"
    ],
    "supporting_modules": [
      "expression_aural"
    ],
    "experience_modules": [
      "timbre",
      "structure"
    ],
    "cross_module": [
      "ensemble",
      "creative_practice"
    ],
    "teacher_ui_grouping": [
      "Rhythm",
      "Melody & Singing"
    ]
  },
  "principles": {
    "learning_path": [
      "listen",
      "imitate",
      "sing",
      "move",
      "read_simple_symbols",
      "apply_in_song",
      "cooperate",
      "make_short_variation"
    ],
    "library_layers": {
      "curriculum_targets": "回答1–2年级应该形成什么能力",
      "machine_materials": "回答Verified Score JSON中有哪些可被程序识别、匹配并拿来教学的音乐材料"
    }
  },
  "modules": {
    "rhythm": {
      "status": "frozen",
      "teaching_language": {
        "quarter_note": "da",
        "eighth_note": "de",
        "sixteenth_note": "di",
        "rest": "kong"
      },
      "targets": {
        "core": [
          {
            "id": "RHY-12-BEAT-01",
            "name": "稳定均拍",
            "description": "能够随音乐找到并用踏步、拍腿、点头、拍手等动作保持基本稳定的共同拍。"
          },
          {
            "id": "RHY-12-TEMPO-01",
            "name": "感受并跟随速度",
            "description": "能够听辨明显快慢，并根据音乐速度调整身体动作。"
          },
          {
            "id": "RHY-12-DURATION-01",
            "name": "基本时值长短关系",
            "description": "通过听、唱、动作和符号，感知并表现全音符、二分音符、四分音符、八分音符、十六分音符的长短关系。"
          },
          {
            "id": "RHY-12-CHANT-01",
            "name": "使用时值唱名读节奏",
            "description": "能够看简单节奏唱出、听后模仿，并在唱熟后转为身体或打击乐演奏。"
          },
          {
            "id": "RHY-12-REST-01",
            "name": "休止与准确返回",
            "description": "理解休止也有时值长度，能够身体停止，并在休止结束后准确返回共同拍。",
            "sequence": [
              "MOVE",
              "FREEZE",
              "RETURN"
            ]
          },
          {
            "id": "RHY-12-GROUP-02",
            "name": "两拍组织",
            "grouping": [
              1,
              2
            ]
          },
          {
            "id": "RHY-12-GROUP-03",
            "name": "三拍组织",
            "grouping": [
              1,
              2,
              3
            ]
          },
          {
            "id": "RHY-12-GROUP-04",
            "name": "四拍组织",
            "grouping": [
              1,
              2,
              3,
              4
            ]
          },
          {
            "id": "RHY-12-MEMORY-01",
            "name": "节奏记忆",
            "description": "能够听后模仿并记住1–4 beat的简单节奏，在Call & Response中保持基本节拍。"
          },
          {
            "id": "RHY-12-ACCOMP-01",
            "name": "歌曲伴奏应用",
            "description": "能够把已学简单Pattern放入真实歌曲，用声势、身体打击乐或简单打击乐器伴奏。"
          },
          {
            "id": "RHY-12-ENSEMBLE-01",
            "name": "简单合作与合奏",
            "description": "能够根据Cue进入、知道自己的轮次、与同伴一起结束。",
            "allowed_forms": [
              "A组→B组轮流",
              "A问→B答",
              "A=Stable Pulse, B=Very Simple Pattern"
            ]
          }
        ],
        "progression": [
          "RHY-12-PAT-05",
          "RHY-12-PAT-06",
          "RHY-12-PAT-07"
        ],
        "experience_extension": [
          "RHY-12-PAT-08"
        ]
      },
      "material_catalog": [
        {
          "id": "PAT-01",
          "name": "一拍一次",
          "level": "core",
          "notation": "♩ ♩",
          "chant": [
            "da",
            "da"
          ],
          "durations": [
            1,
            1
          ]
        },
        {
          "id": "PAT-02",
          "name": "一拍两次",
          "level": "core",
          "notation": "♪♪ ♪♪",
          "chant": [
            "de",
            "de",
            "de",
            "de"
          ],
          "durations": [
            0.5,
            0.5,
            0.5,
            0.5
          ]
        },
        {
          "id": "PAT-03",
          "name": "前密后疏",
          "level": "core",
          "notation": "♪♪ ♩",
          "chant": [
            "de",
            "de",
            "da"
          ],
          "durations": [
            0.5,
            0.5,
            1
          ]
        },
        {
          "id": "PAT-04",
          "name": "前疏后密",
          "level": "core",
          "notation": "♩ ♪♪",
          "chant": [
            "da",
            "de",
            "de"
          ],
          "durations": [
            1,
            0.5,
            0.5
          ]
        },
        {
          "id": "PAT-05",
          "name": "一拍四次",
          "level": "core_progression",
          "notation": "𝅘𝅥𝅯𝅘𝅥𝅯𝅘𝅥𝅯𝅘𝅥𝅯",
          "chant": [
            "di",
            "di",
            "di",
            "di"
          ],
          "durations": [
            0.25,
            0.25,
            0.25,
            0.25
          ]
        },
        {
          "id": "PAT-06",
          "name": "前十六型",
          "level": "progression",
          "notation": "𝅘𝅥𝅯𝅘𝅥𝅯♪",
          "chant": [
            "di",
            "di",
            "de"
          ],
          "durations": [
            0.25,
            0.25,
            0.5
          ]
        },
        {
          "id": "PAT-07",
          "name": "后十六型",
          "level": "progression",
          "notation": "♪𝅘𝅥𝅯𝅘𝅥𝅯",
          "chant": [
            "de",
            "di",
            "di"
          ],
          "durations": [
            0.5,
            0.25,
            0.25
          ]
        },
        {
          "id": "PAT-08",
          "name": "小切分体验",
          "level": "experience_extension",
          "notation": "♪ ♩ ♪",
          "chant": [
            "de",
            "da",
            "de"
          ],
          "durations": [
            0.5,
            1,
            0.5
          ],
          "teaching_note": "只要求能听、能唱、能模仿、能身体表现，不要求解释切分概念。"
        }
      ],
      "capability_path": [
        "HEAR",
        "CHANT",
        "IMITATE",
        "BODY_PLAY",
        "REPEAT",
        "SONG_PLAY",
        "COOPERATE"
      ]
    },
    "melody": {
      "targets": {
        "core": [
          {
            "id": "MEL-12-HILO-01",
            "name": "分辨高与低",
            "description": "通过听觉和身体动作分辨明显的高音与低音。"
          },
          {
            "id": "MEL-12-ORDER-01",
            "name": "感受音高顺序",
            "description": "能够感知并表现越来越高、越来越低、保持差不多。"
          },
          {
            "id": "MEL-12-CONTOUR-01",
            "name": "旋律走向",
            "allowed_contours": [
              "UP",
              "DOWN",
              "LEVEL",
              "MIXED"
            ],
            "description": "能够听辨、模仿和表现短旋律中的基本走向。"
          },
          {
            "id": "MEL-12-MATCH-01",
            "name": "听后模唱",
            "learning_path": [
              "LISTEN",
              "COPY",
              "CHECK_BY_EAR",
              "REPEAT"
            ]
          },
          {
            "id": "MEL-12-PHRASE-01",
            "name": "短旋律乐句",
            "description": "能够听、记忆并模唱短小旋律乐句。"
          },
          {
            "id": "MEL-12-REPEAT-01",
            "name": "重复音/重复旋律感知",
            "description": "能够发现同一个音重复，或相同/相似短旋律再次出现。"
          },
          {
            "id": "MEL-12-ASC-DESC-01",
            "name": "上行/下行演唱",
            "description": "能够跟随示范唱出简单上行、下行音组，并用动作辅助音高变化。"
          }
        ],
        "progression": [
          {
            "id": "MEL-12-PITCH-GROUP-01",
            "name": "小音组快速识读",
            "description": "能够把连续的2–3个音作为一个小音组识读和模唱。"
          }
        ]
      },
      "pitch_materials": [
        {
          "id": "PITCH-SET-DMS",
          "name": "do–mi–sol音组",
          "level": "core_implementation_material",
          "degrees": [
            1,
            3,
            5
          ],
          "solfege": [
            "do",
            "mi",
            "sol"
          ],
          "uses": [
            "音高记忆",
            "简单接唱",
            "短旋律编创",
            "身体高低映射"
          ]
        },
        {
          "id": "PITCH-SCALE-7",
          "name": "基本七音唱名",
          "level": "core_recognition",
          "degrees": [
            1,
            2,
            3,
            4,
            5,
            6,
            7
          ],
          "solfege": [
            "do",
            "re",
            "mi",
            "fa",
            "sol",
            "la",
            "si"
          ]
        },
        {
          "id": "PITCH-OCTAVE-VARIANT",
          "name": "高/中/低音区同名音",
          "level": "progression",
          "schema": {
            "degree": "1..7",
            "octave": [
              -1,
              0,
              1
            ]
          }
        }
      ],
      "machine_materials": [
        {
          "id": "MEL-MAT-REPEAT-NOTE",
          "name": "重复音",
          "match_type": "deterministic",
          "rule": "连续两个及以上非休止音，degree与octave均相同。"
        },
        {
          "id": "MEL-MAT-ASCENDING",
          "name": "简单上行",
          "match_type": "semi_deterministic",
          "rule": "连续短音组总体向上，至少发生一次真实升高，不允许出现明显反向大跳；P0阈值由实现层配置。"
        },
        {
          "id": "MEL-MAT-DESCENDING",
          "name": "简单下行",
          "match_type": "semi_deterministic",
          "rule": "与简单上行相反；P0阈值由实现层配置。"
        },
        {
          "id": "MEL-MAT-LEVEL",
          "name": "平稳/重复为主",
          "match_type": "hybrid",
          "rule": "P0可只识别纯重复音，复杂平稳感由人工标签补充。"
        },
        {
          "id": "MEL-MAT-DMS",
          "name": "do-mi-sol音组片段",
          "match_type": "deterministic_plus_review",
          "rule": "片段只使用degree 1/3/5，并具有足够重复或清晰短句特征。"
        },
        {
          "id": "MEL-MAT-SHORT-PHRASE",
          "name": "适龄短旋律候选",